{
  "manifestVersion": "1.0.0",
  "id": "__BLANK__",
  "label": "__BLANK__",
  "icon": "🧩",
  "route": "/__BLANK__",
  "description": "__BLANK__",
  "category": "Productivity",
  "tier": "plugin",
  "version": "0.1.0",
  "api_routes": true,
  "nav": {
    "group": "apps",
    "order": 50,
    "label": "__BLANK__",
    "icon": "🧩",
    "hidden": false
  },
  "requires": {
    "apis": [],
    "env": [],
    "local": [],
    "blocks": []
  },
  "provides": {
    "routes": true,
    "api": true,
    "models": []
  },
  "contract": {
    "inputs": [],
    "outputs": [],
    "events": [],
    "permissions": {
      "filesystem": "read",
      "network": "internal",
      "secrets": false,
      "shell": false,
      "ai": true
    },
    "storage": {
      "type": "json",
      "scope": "block"
    },
    "ai": {
      "canGenerate": false,
      "canAnalyze": false,
      "canAutomate": false,
      "roles": []
    },
    "targets": {
      "local": true,
      "vercel": true,
      "docker": true,
      "cloudflare": true
    },
    "commands": [],
    "settings_keys": []
  },
  "routes": [
    {
      "method": "ALL",
      "path": "/__BLANK__/*",
      "auth": true
    }
  ],
  "env": [],
  "ai": {
    "capabilities": [],
    "canGenerate": false,
    "canAnalyze": false,
    "canAutomate": false
  },
  "storage": {
    "provider": "json",
    "tables": [],
    "scope": "block"
  },
  "dependencies": [],
  "deployment": {
    "target": "local",
    "runtime": "nodejs"
  }
}
